{
  "xq_version": "0.1",
  "id": "evt:net-demo-tls-001",
  "event_time": "2026-09-06T08:00:03.000000000Z",
  "source": "sensor-01",
  "modality": "xq:network",
  "class": "normalized_observation",
  "profile": "xq.net:profile-0.1",
  "subject": "address:ip:192.0.2.10",
  "object": "endpoint:ip:198.51.100.8:443/tcp",
  "feature": "xq.net:tls_session",
  "action": "xq:observed",
  "polarity": 0,
  "provenance": {
    "producer": "example-network-eventizer",
    "producer_version": "0.1.0",
    "method": "algorithmic",
    "source_records": [
      "example:tls:1"
    ],
    "parameters": {
      "mapping": "tls-normalize"
    }
  },
  "context": {
    "observation_point": "sensor-01",
    "server_name": "example.com",
    "version": "TLSv1.3"
  }
}
