{
  "xq_version": "0.1",
  "id": "evt:interval-001",
  "event_time": "2026-08-30T12:00:00Z",
  "end_time": "2026-08-30T12:10:00Z",
  "source": "example-system",
  "modality": "org.example:process",
  "class": "derived",
  "subject": "entity:1",
  "feature": "org.example:activity",
  "action": "org.example:persisted",
  "state": "org.example:active",
  "polarity": 0,
  "magnitude": 600,
  "unit": "s"
}
