{
  "xq_version": "0.1",
  "id": "evt:net-dhcp-assigned-001",
  "event_time": "2026-09-06T08:10:00Z",
  "source": "sensor-01",
  "modality": "xq:network",
  "class": "normalized_observation",
  "profile": "xq.net:profile-0.1",
  "subject": "interface:mac:00:11:22:33:44:55",
  "object": "address:ip:192.0.2.10",
  "feature": "xq.net:address_binding",
  "action": "xq.net:assigned",
  "polarity": 1,
  "provenance": {
    "producer": "example-network-eventizer",
    "producer_version": "0.1.0",
    "method": "algorithmic",
    "parameters": {
      "mapping": "address_binding-assigned"
    },
    "source_records": [
      "example:dhcp:1"
    ]
  },
  "context": {
    "observation_point": "sensor-01",
    "protocol": "dhcp"
  }
}
