{
  "xq_version": "0.1",
  "id": "evt:example-ais-position-001",
  "event_time": "2026-08-30T11:03:10Z",
  "source": "synthetic-ais-receiver",
  "modality": "xq:ais",
  "class": "observation",
  "subject": "mmsi:235012345",
  "feature": "xq:position",
  "action": "xq:observed",
  "polarity": 0,
  "location": {
    "lat": 50.812,
    "lon": -1.092
  },
  "context": {
    "reported_navigation_status": "at_anchor",
    "sog_kn": 0.2,
    "cog_deg": 247.1
  }
}
