{
  "xq_version": "0.1",
  "id": "evt:net-demo-arp-001",
  "event_time": "2026-09-06T08:00:01.000000000Z",
  "source": "sensor-01",
  "modality": "xq:network",
  "class": "derived",
  "profile": "xq.net:profile-0.1",
  "subject": "interface:mac:00:11:22:33:44:55",
  "object": "address:ip:192.0.2.10",
  "feature": "xq.net:address_binding",
  "action": "xq.net:first_observed",
  "polarity": 1,
  "provenance": {
    "producer": "example-network-eventizer",
    "producer_version": "0.1.0",
    "method": "algorithmic",
    "source_records": [
      "example:arp:1"
    ],
    "parameters": {
      "mapping": "arp-address-binding-first-observation"
    }
  },
  "context": {
    "observation_point": "sensor-01",
    "protocol": "arp",
    "opcode": "request"
  }
}
