{
  "xq_version": "0.1",
  "id": "evt:net-dns-alias-001",
  "event_time": "2026-09-06T08:00:04Z",
  "source": "sensor-01",
  "modality": "xq:network",
  "class": "normalized_observation",
  "profile": "xq.net:profile-0.1",
  "subject": "domain:www.example.com",
  "object": "domain:edge.example.net",
  "feature": "xq.net:name_alias",
  "action": "xq.net:alias_of",
  "polarity": 0,
  "provenance": {
    "producer": "example-network-eventizer",
    "producer_version": "0.1.0",
    "method": "algorithmic",
    "source_records": [
      "example:dns:2"
    ],
    "parameters": {
      "mapping": "dns-alias-normalize"
    }
  },
  "context": {
    "observation_point": "sensor-01",
    "query_type": "A"
  }
}
